{
  "collection": "alpen",
  "description": "Bounded public research snapshot discovered from Alpen Labs' official blog.",
  "entries": [
    {
      "canonical_url": "https://www.alpen.org/blog/partner-integration-testnet-iii",
      "enabled": true,
      "id": "alpen-alpen-enters-partner-integration-phase-32fb363907",
      "local_metadata_file": "documents/alpen/alpen-alpen-enters-partner-integration-phase-32fb363907.metadata.json",
      "managed_by": "scripts/ingest_sources.py",
      "raw_file": "raw/alpen/alpen-alpen-enters-partner-integration-phase-32fb363907.html",
      "retrieved_at": "2026-08-24T21:53:09Z",
      "sha256": "09f2ea8cb3db2608abae7f7138416f234863a7aae047a7959b378e881f39a97b"
    },
    {
      "canonical_url": "https://www.alpen.org/blog/chainflow-joins-alpen-as-an-independent-operator",
      "enabled": true,
      "id": "alpen-chainflow-joins-alpen-as-an-independent-operator-0d9d2cf643",
      "local_metadata_file": "documents/alpen/alpen-chainflow-joins-alpen-as-an-independent-operator-0d9d2cf643.metadata.json",
      "managed_by": "scripts/ingest_sources.py",
      "raw_file": "raw/alpen/alpen-chainflow-joins-alpen-as-an-independent-operator-0d9d2cf643.html",
      "retrieved_at": "2026-08-24T21:53:09Z",
      "sha256": "c94c76c1a0941af4eed4c8b210cc28036375735f4cf663a1c34d3a870f6454c4"
    },
    {
      "canonical_url": "https://www.alpen.org/blog/glock-verification-on-bitcoin",
      "enabled": true,
      "id": "alpen-glock-a-new-standard-for-verification-on-bitcoin-73dea6f050",
      "local_metadata_file": "documents/alpen/alpen-glock-a-new-standard-for-verification-on-bitcoin-73dea6f050.metadata.json",
      "managed_by": "scripts/ingest_sources.py",
      "raw_file": "raw/alpen/alpen-glock-a-new-standard-for-verification-on-bitcoin-73dea6f050.html",
      "retrieved_at": "2026-08-24T21:53:09Z",
      "sha256": "8b4afd90b126554a23cffc3d16da7e7c2c96a20ae1b391da58feb0d31067ec8e"
    },
    {
      "canonical_url": "https://www.alpen.org/blog/introducing-mosaic-glocks-final-piece",
      "enabled": true,
      "id": "alpen-introducing-mosaic-glock-s-final-piece-f60373c193",
      "local_metadata_file": "documents/alpen/alpen-introducing-mosaic-glock-s-final-piece-f60373c193.metadata.json",
      "managed_by": "scripts/ingest_sources.py",
      "raw_file": "raw/alpen/alpen-introducing-mosaic-glock-s-final-piece-f60373c193.html",
      "retrieved_at": "2026-08-24T21:53:09Z",
      "sha256": "fb9a5781c3afee77b37816a6c8176d6e0ad9aa1853854e62b0852fd078bcaa8c"
    },
    {
      "canonical_url": "https://www.alpen.org/blog/proof-of-work",
      "enabled": true,
      "id": "alpen-proof-of-work-1a519d7d64",
      "local_metadata_file": "documents/alpen/alpen-proof-of-work-1a519d7d64.metadata.json",
      "managed_by": "scripts/ingest_sources.py",
      "raw_file": "raw/alpen/alpen-proof-of-work-1a519d7d64.html",
      "retrieved_at": "2026-08-24T21:53:09Z",
      "sha256": "4a48f4afe9ce8edd942b51f2aa13b473ce8a881042727df815d1e9175082ce7c"
    },
    {
      "canonical_url": "https://www.alpen.org/blog/stakely-joins-alpen-as-an-independent-operator",
      "enabled": true,
      "id": "alpen-stakely-joins-alpen-as-an-independent-operator-59e2dd13b6",
      "local_metadata_file": "documents/alpen/alpen-stakely-joins-alpen-as-an-independent-operator-59e2dd13b6.metadata.json",
      "managed_by": "scripts/ingest_sources.py",
      "raw_file": "raw/alpen/alpen-stakely-joins-alpen-as-an-independent-operator-59e2dd13b6.html",
      "retrieved_at": "2026-08-24T21:53:09Z",
      "sha256": "d1e4249f65a2b514aace13ba8e4d706b4170cc902d08d62d2edd59521bf99a39"
    }
  ],
  "homepage": "https://www.alpen.org/",
  "id": "alpen",
  "ingestion": {
    "discovery_urls": [
      "https://www.alpen.org/blog"
    ],
    "expected_formats": [
      "text/html"
    ],
    "mode": "registry-fetcher",
    "notes": "Incremental snapshot managed by scripts/ingest_sources.py; see library/ingestion/latest-report.json.",
    "status": "ingested"
  },
  "rights": {
    "policy": "Source copyright is retained; no redistribution license is asserted."
  },
  "schema_version": "1.0.0",
  "source_name": "Alpen Labs research"
}
