{
  "collection": "delving-bitcoin",
  "description": "Manifest for technically relevant Delving Bitcoin discussions and a bounded public Discourse snapshot.",
  "entries": [
    {
      "canonical_url": "https://delvingbitcoin.org/t/a-design-bar-for-coercion-resistant-custody-and-where-duressfeatures-land-against-it/2832",
      "enabled": true,
      "id": "delving-bitcoin-a-design-bar-for-coercion-resistant-custody-and-where-duressfe-6da6c5c5c4",
      "local_metadata_file": "documents/delving-bitcoin/delving-bitcoin-a-design-bar-for-coercion-resistant-custody-and-where-duressfe-6da6c5c5c4.metadata.json",
      "managed_by": "scripts/ingest_sources.py",
      "raw_file": "raw/delving-bitcoin/delving-bitcoin-a-design-bar-for-coercion-resistant-custody-and-where-duressfe-6da6c5c5c4.json",
      "retrieved_at": "2026-08-24T21:52:39Z",
      "sha256": "2899be576ae45f48f52dbae7edc6b34cdf7674cfb0cf157ec9ae522651574de2"
    },
    {
      "canonical_url": "https://delvingbitcoin.org/t/faster-txid-hash-tables-with-siphash-1-3-uj/2834",
      "enabled": true,
      "id": "delving-bitcoin-faster-txid-hash-tables-with-siphash-1-3-uj-6f705f593e",
      "local_metadata_file": "documents/delving-bitcoin/delving-bitcoin-faster-txid-hash-tables-with-siphash-1-3-uj-6f705f593e.metadata.json",
      "managed_by": "scripts/ingest_sources.py",
      "raw_file": "raw/delving-bitcoin/delving-bitcoin-faster-txid-hash-tables-with-siphash-1-3-uj-6f705f593e.json",
      "retrieved_at": "2026-08-24T21:52:39Z",
      "sha256": "d0e29fb3b39ba9d7eec2a023210ea4c65a40a85be515d0bfdb225eee96fa01f2"
    },
    {
      "canonical_url": "https://delvingbitcoin.org/t/pqc-output-type-discussion/2749",
      "enabled": true,
      "id": "delving-bitcoin-pqc-output-type-discussion-2dcb05a9b1",
      "local_metadata_file": "documents/delving-bitcoin/delving-bitcoin-pqc-output-type-discussion-2dcb05a9b1.metadata.json",
      "managed_by": "scripts/ingest_sources.py",
      "raw_file": "raw/delving-bitcoin/delving-bitcoin-pqc-output-type-discussion-2dcb05a9b1.json",
      "retrieved_at": "2026-08-24T21:52:39Z",
      "sha256": "f2fcf553cf2f67658f43b0a02773061c3e3c83c588d30fe02ab46462ea97c9dc"
    },
    {
      "canonical_url": "https://delvingbitcoin.org/t/seedroller-and-keyderiver-cli-tools-to-generate-bip39-seed-words-and-derive-bip380-keys/2822",
      "enabled": true,
      "id": "delving-bitcoin-seedroller-and-keyderiver-cli-tools-to-generate-bip39-seed-wor-63dac8a4e0",
      "local_metadata_file": "documents/delving-bitcoin/delving-bitcoin-seedroller-and-keyderiver-cli-tools-to-generate-bip39-seed-wor-63dac8a4e0.metadata.json",
      "managed_by": "scripts/ingest_sources.py",
      "raw_file": "raw/delving-bitcoin/delving-bitcoin-seedroller-and-keyderiver-cli-tools-to-generate-bip39-seed-wor-63dac8a4e0.json",
      "retrieved_at": "2026-08-24T21:52:39Z",
      "sha256": "c11a525b04db0deb374e1b19a9615832d209fd5e26c10806376e8f4c1795a188"
    },
    {
      "canonical_url": "https://delvingbitcoin.org/t/silent-payments-coinbase/2833",
      "enabled": true,
      "id": "delving-bitcoin-silent-payments-coinbase-0993db5669",
      "local_metadata_file": "documents/delving-bitcoin/delving-bitcoin-silent-payments-coinbase-0993db5669.metadata.json",
      "managed_by": "scripts/ingest_sources.py",
      "raw_file": "raw/delving-bitcoin/delving-bitcoin-silent-payments-coinbase-0993db5669.json",
      "retrieved_at": "2026-08-24T21:52:39Z",
      "sha256": "02dc77b7ab92fb9e852509ad8005c3463df9622be63c58585790619a8c844583"
    },
    {
      "canonical_url": "https://delvingbitcoin.org/t/welcome-to-delving-bitcoin/7",
      "enabled": true,
      "id": "delving-bitcoin-welcome-to-delving-bitcoin-864521bd95",
      "local_metadata_file": "documents/delving-bitcoin/delving-bitcoin-welcome-to-delving-bitcoin-864521bd95.metadata.json",
      "managed_by": "scripts/ingest_sources.py",
      "raw_file": "raw/delving-bitcoin/delving-bitcoin-welcome-to-delving-bitcoin-864521bd95.json",
      "retrieved_at": "2026-08-24T21:52:39Z",
      "sha256": "6fb11478ab96987843f22fad6a1442aa4ec72e7b7d938e4dafe29929987ced2c"
    },
    {
      "canonical_url": "https://delvingbitcoin.org/",
      "enabled": true,
      "id": "delving-package-relay-fixture",
      "local_metadata_file": "documents/delving-bitcoin/package-relay-fixture.metadata.json"
    }
  ],
  "homepage": "https://delvingbitcoin.org/",
  "id": "delving-bitcoin",
  "ingestion": {
    "discovery_urls": [
      "https://delvingbitcoin.org/latest.json"
    ],
    "expected_formats": [
      "application/json",
      "text/html"
    ],
    "mode": "registry-fetcher",
    "notes": "Incremental snapshot managed by scripts/ingest_sources.py; see library/ingestion/latest-report.json.",
    "status": "ingested"
  },
  "rights": {
    "policy": "Store links and metadata by default. Verify forum and author licensing before copying external post text."
  },
  "schema_version": "1.0.0",
  "source_name": "Delving Bitcoin"
}
